[
  {
    "event_id": "evt-blh-0001",
    "event_type": "ASSET_REGISTERED",
    "aggregate_type": "shared_asset",
    "aggregate_id": "node-gallery-km0",
    "occurred_at": "2026-04-20T09:00:00+08:00",
    "version": 1,
    "summary": "登记百里画廊0公里观景道路节点",
    "payload": {
      "asset_kind": "road_node",
      "village": "画廊村",
      "owner": "collective",
      "funded_by": "fiscal",
      "location_name": "百里画廊0公里观景点",
      "maintenance_responsible_party": "collective-hualang"
    }
  },
  {
    "event_id": "evt-blh-0002",
    "event_type": "ASSET_REGISTERED",
    "aggregate_type": "shared_asset",
    "aggregate_id": "toilet-gallery-km0",
    "occurred_at": "2026-04-20T09:05:00+08:00",
    "version": 1,
    "summary": "登记财政资金修建的0公里节点旅游厕所",
    "payload": {
      "asset_kind": "public_toilet",
      "village": "画廊村",
      "owner": "government",
      "funded_by": "fiscal",
      "location_name": "0公里节点旅游厕所",
      "road_node_asset_id": "node-gallery-km0",
      "present_at_asset_id": "node-gallery-km0",
      "maintenance_responsible_party": "collective-hualang"
    }
  },
  {
    "event_id": "evt-blh-0003",
    "event_type": "ASSET_REGISTERED",
    "aggregate_type": "shared_asset",
    "aggregate_id": "yard-hualang-station",
    "occurred_at": "2026-04-20T09:10:00+08:00",
    "version": 1,
    "summary": "登记村集体院落（驿站咖啡用房）",
    "payload": {
      "asset_kind": "collective_yard",
      "village": "画廊村",
      "owner": "collective",
      "funded_by": "collective",
      "location_name": "画廊村老村委院落",
      "maintenance_responsible_party": "collective-hualang"
    }
  },
  {
    "event_id": "evt-blh-0004",
    "event_type": "ASSET_REGISTERED",
    "aggregate_type": "shared_asset",
    "aggregate_id": "site-stall-km0",
    "occurred_at": "2026-04-20T09:15:00+08:00",
    "version": 1,
    "summary": "登记0公里节点季节性摊位点位",
    "payload": {
      "asset_kind": "stall_site",
      "village": "画廊村",
      "owner": "collective",
      "funded_by": "collective",
      "location_name": "0公里节点摊区A位",
      "road_node_asset_id": "node-gallery-km0",
      "present_at_asset_id": "node-gallery-km0",
      "maintenance_responsible_party": "collective-hualang"
    }
  },
  {
    "event_id": "evt-blh-0005",
    "event_type": "ASSET_REGISTERED",
    "aggregate_type": "shared_asset",
    "aggregate_id": "eqp-coffee-bar",
    "occurred_at": "2026-04-20T09:20:00+08:00",
    "version": 1,
    "summary": "登记运营商自带可搬离咖啡吧台设备",
    "payload": {
      "asset_kind": "equipment",
      "village": "画廊村",
      "owner": "operator",
      "funded_by": "operator",
      "location_name": "驿站咖啡吧台",
      "present_at_asset_id": "yard-hualang-station",
      "removable": true,
      "maintenance_responsible_party": "op-yunshu-travel"
    }
  },
  {
    "event_id": "evt-blh-0006",
    "event_type": "ASSET_REGISTERED",
    "aggregate_type": "shared_asset",
    "aggregate_id": "yard-yunqi-08",
    "occurred_at": "2026-04-20T09:25:00+08:00",
    "version": 1,
    "summary": "登记云栖村8号民宿院落",
    "payload": {
      "asset_kind": "collective_yard",
      "village": "云栖村",
      "owner": "collective",
      "funded_by": "collective",
      "location_name": "云栖村8号院",
      "maintenance_responsible_party": "collective-yunqi"
    }
  },
  {
    "event_id": "evt-blh-0007",
    "event_type": "ASSET_REGISTERED",
    "aggregate_type": "shared_asset",
    "aggregate_id": "node-yunqi-gate",
    "occurred_at": "2026-04-20T09:30:00+08:00",
    "version": 1,
    "summary": "登记云栖入口道路节点",
    "payload": {
      "asset_kind": "road_node",
      "village": "云栖村",
      "owner": "collective",
      "funded_by": "fiscal",
      "location_name": "云栖入口",
      "maintenance_responsible_party": "collective-yunqi"
    }
  },
  {
    "event_id": "evt-blh-0008",
    "event_type": "CAPACITY_DEFINED",
    "aggregate_type": "eco_capacity",
    "aggregate_id": "cap-yunqi-gate",
    "occurred_at": "2026-04-25T10:00:00+08:00",
    "version": 1,
    "summary": "云栖入口日生态容量核定为800人次",
    "payload": {
      "node_asset_id": "node-yunqi-gate",
      "metric": "persons",
      "daily_cap": 800
    }
  },
  {
    "event_id": "evt-blh-0009",
    "event_type": "TERM_GRANTED",
    "aggregate_type": "operating_term",
    "aggregate_id": "term-yunshu-2026",
    "occurred_at": "2026-04-28T14:00:00+08:00",
    "version": 1,
    "summary": "公开竞价授予云舒文旅2026旺季驿站咖啡许可（5月1日至10月25日）",
    "payload": {
      "party_id": "op-yunshu-travel",
      "village": "画廊村",
      "scope": "station_cafe",
      "asset_ids": [
        "yard-hualang-station"
      ],
      "starts_at": "2026-05-01T00:00:00+08:00",
      "ends_at": "2026-10-25T23:59:59+08:00",
      "seasonal": true,
      "grant_basis": "open_bid",
      "conditions": {
        "厕所首问维护": true,
        "就业岗位": 6,
        "本地用工下限": 4
      }
    }
  },
  {
    "event_id": "evt-blh-0010",
    "event_type": "TERM_GRANTED",
    "aggregate_type": "operating_term",
    "aggregate_id": "term-shanju-2026",
    "occurred_at": "2026-04-28T14:30:00+08:00",
    "version": 1,
    "summary": "授予山居民宿2026旺季经营许可",
    "payload": {
      "party_id": "op-shanju-stay",
      "village": "云栖村",
      "scope": "homestay",
      "asset_ids": [
        "yard-yunqi-08"
      ],
      "starts_at": "2026-05-01T00:00:00+08:00",
      "ends_at": "2026-10-25T23:59:59+08:00",
      "seasonal": true,
      "grant_basis": "rotation"
    }
  },
  {
    "event_id": "evt-blh-0011",
    "event_type": "PLEDGE_MADE",
    "aggregate_type": "employment_pledge",
    "aggregate_id": "pledge-yunshu-2026",
    "occurred_at": "2026-04-28T15:00:00+08:00",
    "version": 1,
    "summary": "云舒文旅承诺旺季提供6个岗位、本地用工不少于4人、月工资不低于2200元",
    "payload": {
      "term_id": "term-yunshu-2026",
      "operator_party_id": "op-yunshu-travel",
      "positions_total": 6,
      "local_positions_min": 4,
      "wage_min_cents": 220000,
      "season": "2026旺季"
    }
  },
  {
    "event_id": "evt-blh-0012",
    "event_type": "STALL_PERMIT_ISSUED",
    "aggregate_type": "seasonal_stall",
    "aggregate_id": "stall-wang-2026",
    "occurred_at": "2026-06-28T10:00:00+08:00",
    "version": 1,
    "summary": "王姐取得0公里摊区A位夏秋季节许可",
    "payload": {
      "site_asset_id": "site-stall-km0",
      "party_id": "vendor-wang-jie",
      "village": "画廊村",
      "season": "2026夏秋",
      "starts_at": "2026-07-01T00:00:00+08:00",
      "ends_at": "2026-09-30T23:59:59+08:00"
    }
  },
  {
    "event_id": "evt-blh-0013",
    "event_type": "REPAIR_OPENED",
    "aggregate_type": "repair_order",
    "aggregate_id": "repair-toilet-0710",
    "occurred_at": "2026-07-10T09:00:00+08:00",
    "version": 1,
    "summary": "0公里财政厕所供水管破裂开单",
    "payload": {
      "asset_id": "toilet-gallery-km0",
      "fault": "供水管破裂停水",
      "reported_by": "volunteer-zhou",
      "opened_at": "2026-07-10T09:00:00+08:00"
    }
  },
  {
    "event_id": "evt-blh-0014",
    "event_type": "REPAIR_CLAIMED",
    "aggregate_type": "repair_order",
    "aggregate_id": "repair-toilet-0710",
    "occurred_at": "2026-07-10T11:00:00+08:00",
    "version": 2,
    "summary": "驿站运营商按许可条件首问认领维修",
    "payload": {
      "repair_order_id": "repair-toilet-0710",
      "claimed_by": "op-yunshu-travel",
      "basis": "许可条件：驿站运营商承担节点财政厕所日常维修首问责任"
    }
  },
  {
    "event_id": "evt-blh-0015",
    "event_type": "REPAIR_COMPLETED",
    "aggregate_type": "repair_order",
    "aggregate_id": "repair-toilet-0710",
    "occurred_at": "2026-07-11T16:00:00+08:00",
    "version": 3,
    "summary": "厕所维修完工，费用1800元由运营商承担800、村集体承担1000",
    "payload": {
      "cost_cents": 180000,
      "borne_by": [
        {
          "party_id": "op-yunshu-travel",
          "share_cents": 80000
        },
        {
          "party_id": "collective-hualang",
          "share_cents": 100000
        }
      ],
      "evidence_ref": "ev-repair-invoice-0711",
      "completed_at": "2026-07-11T16:00:00+08:00"
    }
  },
  {
    "event_id": "evt-blh-0016",
    "event_type": "CONSIGNMENT_DELIVERED",
    "aggregate_type": "consignment",
    "aggregate_id": "batch-honey-2026",
    "occurred_at": "2026-07-05T08:30:00+08:00",
    "version": 1,
    "summary": "柳湾村马桂凤交付200瓶土蜂蜜寄售，单价30元，未售退回",
    "payload": {
      "term_id": "term-yunshu-2026",
      "supplier_party_id": "farmer-ma-guifeng",
      "seller_party_id": "op-yunshu-travel",
      "village": "画廊村",
      "items_summary": "土蜂蜜500g装",
      "quantity": 200,
      "unit": "瓶",
      "unit_price_cents": 3000,
      "unsold_policy": "return",
      "delivered_at": "2026-07-05T08:30:00+08:00"
    }
  },
  {
    "event_id": "evt-blh-0017",
    "event_type": "CONSIGNMENT_SOLD",
    "aggregate_type": "consignment",
    "aggregate_id": "batch-honey-2026",
    "occurred_at": "2026-07-20T15:00:00+08:00",
    "version": 2,
    "summary": "寄售蜂蜜售出60瓶，佣金一成",
    "payload": {
      "quantity": 60,
      "gross_cents": 180000,
      "commission_cents": 18000,
      "order_ref": "ord-0720-11",
      "sold_at": "2026-07-20T15:00:00+08:00",
      "point_of_sale_asset_id": "yard-hualang-station"
    }
  },
  {
    "event_id": "evt-blh-0018",
    "event_type": "CONSIGNMENT_SOLD",
    "aggregate_type": "consignment",
    "aggregate_id": "batch-honey-2026",
    "occurred_at": "2026-08-02T11:00:00+08:00",
    "version": 3,
    "summary": "寄售蜂蜜售出50瓶",
    "payload": {
      "quantity": 50,
      "gross_cents": 150000,
      "commission_cents": 15000,
      "order_ref": "ord-0802-07",
      "sold_at": "2026-08-02T11:00:00+08:00",
      "point_of_sale_asset_id": "yard-hualang-station"
    }
  },
  {
    "event_id": "evt-blh-0019",
    "event_type": "REFERRAL_RECORDED",
    "aggregate_type": "referral",
    "aggregate_id": "referral-2201",
    "occurred_at": "2026-07-15T13:20:00+08:00",
    "version": 1,
    "summary": "驿站咖啡向云栖山居民宿导流1位客人，留存二维码凭证",
    "payload": {
      "source_party_id": "op-yunshu-travel",
      "source_village": "画廊村",
      "target_party_id": "op-shanju-stay",
      "target_village": "云栖村",
      "node_asset_id": "node-gallery-km0",
      "channel": "驿站台卡二维码",